	inst	cnt	len
2110	英屬維京群島商博京漢有限公司	4	14
2111	英屬維京群島商 KARTIGEN BIOMEDICINE INC.	4	33
2112	日商 UNITECH CO., LTD	4	19
2113	日商山葉株式會社	4	8
2114	NOVA BIOMEDICAL CORPORATION	4	27
2115	薩摩亞商GREEN GIANT TECHNOLOGY CORPORATION	4	38
2116	美商伊利諾工具公司(Illonois Tool Works Inc.)	4	35
2117	英商太古輪船有限公司	4	10
2118	日商 Axalta Shinto Coating Systems Co., Ltd.	4	42
2119	荷蘭商Garmatex Technologies.B.V.	4	29
2120	LEARNBANK CORP.	4	15
2121	財團法人吳舜文工商發展策進會	4	14
2122	德商 Fresenius Kabi Deutschland GmbH	4	34
2123	日商Y.S. FOOD CO., LTD.	4	21
2124	薩摩亞商 High Profit Overseas Investment Ltd.	4	41
2125	英屬維京群島商 FANDORA HOLDING LIMITED	4	31
2126	荷蘭商Modere  B. V.	4	16
2127	薩摩亞商Rich 1 Estate International Corporation	4	43
2128	法商 Asah Lm	4	10
2129	ACE Lojistik Hizmetleri A.S.	4	28
2130	英屬維京群島商Top Vast Investments Limited	4	35
2131	香港商熱速得控股股份有限公司 PYROSWIFT HOLDING CO., LTD.	4	42
2132	美商 Motorola Solutions, Inc.	4	27
2133	英屬蓋曼群島商 MORGAN STANLEY ASIA SECURITIES PRODUCTS LLC	4	51
2134	英屬維京群島商 ANNYTIME ENTERTAINMENT CORPORATION	4	42
2135	HANBURY IFA CORPORATION LIMITED	4	31
2136	香港商王氏港建(集團)有限公司	4	15
2137	日商東芝機械株式會社	4	10
2138	日商 FLIGHT SYSTEM CONSULTING INC.(株式会社 　　　　　　　　　　　　　　　　）	4	55
2139	韓商 HYOSUNG CORPORATION	4	22
2140	德商 Melchers Trading GmbH	4	24
2141	英屬蓋曼群島商富祐鴻科技股份有限公司	4	18
2142	日商堺商事株式會社	4	9
2143	香港商索思未來科技亞太有限公司(SOCIONEXT TECHNOLOGY PACIFIC ASIA LIMITED)	4	58
2144	美商東方公司The Eastern Company	4	25
2145	香港商東海精工(香港)有限公司	4	15
2146	日商羅拉婀雪萊株式會社	4	11
2147	英屬維京群島商 D.J. AMC INC	4	20
2148	日商 EQS, INC.	4	12
2149	荷蘭商捷邦安全軟體科技有限公司	4	15
2150	新加坡商林內太平洋控股有限公司	4	15
2151	日商Crescent, Inc.	4	16
2152	薩摩亞商雪爾萊克股份有限公司	4	14
2153	毅結特投資國際有限公司(EJOT Invest International GmbH)	4	43
2154	台中市基督教青年會	4	9
2155	日商樂天 Card 株式會社	4	14
2156	SK Materials Co., Ltd.	4	22
2157	ACTIVE GAIN HOLDINGS LIMITED	4	28
2158	日商 ASATSU-DK INC. (株式會社　　　　‧　)	4	30
2159	Georg Jensen A/S (丹麥商喬治傑生股份有限公司)	4	32
2160	LICHEN  FINANCE  LIMITED	4	24
2161	瑞士商偉拓控股股份有限公司(VAT Holding AG)	4	29
2162	日商Sun · Core HLDS. Co., Ltd	4	27
2163	日商FE  TRADE  株式會社(FE  TRAED  CO.,  LTD.)	4	40
2164	薩摩亞商永信有限公司	4	10
2165	新加坡商奐鑫控股有限公司	4	12
2166	英屬維京群島商瀚智領域有限公司	4	15
2167	模里西斯商信瑞投資股份有限公司(KING STONE INTERNATIONAL LIMITED)	4	49
2168	瑞柏科技控股有限公司	4	10
2169	荷蘭商 TECTURA (NETHERLANDS) B. V.	4	31
2170	新加坡商 Nomura Research Institute Asia Pacific Private Limited	4	59
2171	英屬維京群島商 Success Media Group Limited	4	35
2172	馬來西亞商廣志有限公司	4	11
2173	英屬蓋曼群島商SST國際有限公司	4	16
2174	馬來西亞商 TPK Asia Pacific Sdn. Bhd.	4	32
2175	日商D.A.CONSORTIUM INC.	4	21
2176	英屬維京群島商 Jenco 投資開發有限公司	4	22
2177	英屬開曼群島商 Aprevent Medical Inc.	4	29
2178	英商 Arris Solutions UK Ltd.	4	26
2179	Qualcomm Global Trading Inc.	4	28
2180	日商NIDEC-SHIMPO CORPORATION（日本電產シンポ株式会社）	4	39
2181	荷蘭商凱絡有限公司 [Group Carat(Nederland)B.V.]	4	38
2182	日商 TECHTUIT CO., LTD.	4	21
2183	日商株式會社フジキン(FUJIKIN INCORPORATED)	4	32
2184	日商 DYNACOMWARE CORPORATION	4	26
2185	英屬維京群島商糖朝(台灣)有限公司	4	17
2186	荷商七和工具控股公司	4	10
2187	新加坡商萬宙商信亞太控股股份有限公司	4	18
2188	臺南市農會	4	5
2189	日商株式會社山卜小笠原商店	4	13
2190	德商 Logwin Air+Ocean International GmbH	4	38
2191	日商 SIIX Corporation	4	19
2192	SG ファイナンス業株式會社(日商SG FINANCE CO., LTD.)	4	38
2193	日商旭化成株式會社	4	9
2194	OneWorks IP Holdings Limited	4	28
2195	英屬維爾京群島商艾霍寧股份有限公司	4	17
2196	香港商極光服飾國際有限公司	4	13
2197	美商 FarStone Technology Inc.	4	27
2198	英屬維京群島商 KKTOWN International Limited	4	36
2199	英屬維京群島商 RUBYTOP  LIMITED	4	24
2200	日商新明和工業株式會社	4	11
2201	荷蘭商 Uber International Holding B.V.	4	35
2202	Meyer Burger Technology AG	4	26
2203	英屬開曼群島商 PILOTTV HOLDINGS LIMITED	4	32
2204	百慕達商東方海外(代理)有限公司	4	16
2205	United Union Corp.	4	18
2206	中小企業發展基金管理委員會	4	13
2207	健康(中國)控股集團有限公司Wellness (China) Holding Group Limited	4	52
2208	荷蘭商 NXP  B. V.	4	14
2209	ACROCHIP TECHNOLOGY INC.	4	24
2210	Froniter International Holdinga Limited	4	39
2211	薩摩亞商ADEPT AWARENESS INVESTMENTS LIMITED.	4	40
2212	挪威商寶威船務代理有限公司 (Barwil Agencies AS)	4	34
2213	MVP (H.K) INDUSTRIES LIMITED	4	28
2214	日商OGIC CO.,LTD.	4	15
2215	日商 FoneN Co., Ltd.	4	18
2216	荷蘭商Hoya Holdings (Asia) B.V.	4	28
2217	SCHMOLZ + BICKENBACH International GmbH	4	39
2218	日商株式会社　相建技術(株式会社　相建　　　　　)	4	25
2219	日商大陽工業株式會社	4	10
2220	香港商 Illies East Asia Limited	4	28
2221	新加坡商 Awfully Chocolate Franchise Management Pte Ltd.	4	52
2222	LOGITEM INTERNATIONAL CORP.	4	27
2223	澳大利亞商比富比控股股份有限公司	4	16
2224	日商大豊化学株式会社	4	10
2225	日商リバ一ェレテック利巴電技株式會社	4	18
2226	盧森堡商KSIN盧森堡Ⅱ有限公司	4	16
2227	蕯摩亞商 HOLY GRAIL INTERNATIONAL GROUP LIMITED	4	43
2228	日商奧璐佳瑙株式會社	4	10
2229	新加坡商 INTERTOUCH PTE. LTD.	4	25
2230	法商 VEOLIA  WATER  SOLUTIONS	4	27
2231	香港商 China Systems Holdings Limited	4	34
2232	塞席爾商菲尼克斯環球有限公司	4	14
2233	英商亞太精選服務有限公司	4	12
2234	株式會社工　　　	4	8
2235	香港商浩騰媒體有限公司(OMNICOM MEDIA GROUP GREATER CHINA LIMITED)	4	54
2236	荷蘭商Solenis Netherlands B.V.	4	27
2237	薩摩亞商冠佳投資股份有限公司(KUAN CHIA INVESTMENTS CO., LTD.)	4	47
2238	新加坡商TRUMPF Pte Ltd.	4	19
2239	KOJIMA CORPORATION	4	18
2240	英屬維京群島商 Billion Collection Corp.	4	32
2241	新加坡商華達利控股份有限公司	4	14
2242	美商美世 LLC 公司(Mercer LLC)	4	23
2243	日商株式会社　　　　(Marutaka Co., Ltd)	4	29
2244	香港商英之傑航運(香港)有限公司	4	16
2245	日商 HAGIWARA SYS-COM CO,. LTD.	4	29
2246	香港商天祥公證行太平洋有限公司(Intertek Testing Services Pacific Ltd.)	4	55
2247	新加坡商ANT BRIDGE CAP. PTE. LTD.	4	29
2248	荷蘭商輝凌股份有限公司	4	11
2249	蕯摩亞商 UNIC PACIFIC CAPITAL CORP.,LTD	4	35
2250	英屬開曼群島商 Fiiser Inc.	4	19
2251	日商桂川電機株式會社	4	10
2252	塞席爾商ALL SUN LTD. 全日有限公司	4	23
2253	英屬維京群島商 Feronia Venture Capital Ltd.	4	36
2254	英屬維京群島商 CAI ASIA LTD.	4	21
2255	英屬維京群島商 GENIUS CHOICE HOLDINGS LIMITED	4	38
2256	日商TAKIGEN  MFG. CO .,LTD	4	24
2257	日商三洋化成工業株式會社	4	12
2258	荷蘭商SUMMIT GLOBAL MANAGEMENT IIB.V.	4	34
2259	日商JSR株式會社	4	9
2260	英屬安圭拉島商晶采動能有限公司	4	15
2261	英屬維京群島商Great Prospects Holdings Limited	4	39
2262	英屬開曼群島商Centerillion Taiwan Corporation	4	38
2263	美商 Dentsply International Inc.	4	30
2264	株式會社■■■■■ク■■	4	12
2265	香港商Winking Inspiration Holdings Limited	4	39
2266	荷蘭商 Global Blue Holland B.V.	4	28
2267	美商 Google International LLC	4	27
2268	日商佳能股份有限公司	4	10
2269	日商優妮嬌盟股份有限公司	4	12
2270	盧森堡商地中海會公司	4	10
2271	MEREGAN PUBLISHING INC.	4	23
2272	模里西斯商 GE MAURITIUS INFRASTRUCTURE HOLDINGS LTD	4	46
2273	瑞士商科萊恩國際股份有限公司	4	14
2274	英屬開曼群島商 IPGreat Incorporated	4	28
2275	薩摩亞商國際遠景股份有限公司	4	14
2276	日商日研食品株式會社	4	10
2277	法商蒂汎蕾有限公司 Devanlay SA	4	21
2278	英屬維京群島商艾瑪士投資有限公司	4	16
2279	英屬維京群島商ALLIANCE MANAGEMENT CONSULTING CO., LTD.	4	47
2280	英屬開曼群島商 OKHERO  LIMITED	4	23
2281	日商 HIGASHIMARU INTERNATIONAL CORPORATION	4	40
2282	香港商 ASIA UNITED-AVIVA HOLDINGS LIMITED	4	38
2283	Altek Semiconductor (Cayman) Co., Ltd.	4	38
2284	日商株式會社大廣	4	8
2285	模里西斯商 INNOVATIVE SONIC LIMITED	4	30
2286	日本商HIGASHIYAMA FILM CO.,LTD.	4	28
2287	日商 IHI 運搬機械株式會社	4	15
2288	日商昭和電工股份有限公司	4	12
2289	日商康肯科技株式會社	4	10
2290	英屬蓋曼群島商 eSOON Group Holdings Corp.	4	34
2291	荷蘭商寶格麗國際有限公司	4	12
2292	日商株式會社　　　　　　(日商 FOODEX CORPORATION)	4	35
2293	GNXT INVESTMENT HOLDINGS PTE.LTD.	4	33
2294	全球工業集團Global Industries Holdings Ltd	4	36
2295	澳大利亞商耐美力海外控股公司	4	14
2296	Nuliv Holding Inc.	4	18
2297	日商J.E.T.CO.,LTD.	4	16
2298	日商北斗機械株式會社(日商 HOKUTO MACHINERY CO., LTD.)	4	41
2299	日商日本康大可株式會社	4	11
2300	薩摩亞商PIONEER LEADER INVESTMENTS LIMITED.	4	39
2301	美商IMPCT CORPORATION	4	19
2302	(香港商)美林工業集團有限公司	4	15
2303	日商建和商事株式會社	4	10
2304	美商傑士莫股份有限公司	4	11
2305	瑞士商 Adecco Invest S.A.	4	22
2306	薩摩亞商 PRIMO OPTO GROUP LIMITED	4	29
2307	香港商斯達康有限公司  (Utstarcom Hong Kong Limited)	4	41
2308	新加坡商友發國際股份有限公司	4	14
2309	香港商騎樂菲國際有限公司	4	12
2310	日商株式會社芝浦製作所	4	11
2311	韓商PSK Inc.	4	10
2312	日商兄弟國際株式會社	4	10
2313	日商東洋機械金屬株式會社	4	12
2314	香港商中南創發實業香港有限公司	4	15
2315	日商 TOOL 株式會社(TOOL CORPORATION)	4	30
2316	財團法人宗倬章先生教育基金會	4	14
2317	美商 APM Foreign Holdings LLC	4	27
2318	英屬維京群島商星展國際有限公司Star Growth International limited	4	48
2319	英屬維京群島商 WORLD FAMILY ENGLISH HOLDINGS LTD.	4	42
2320	日本バルヵー工業株式会社	4	12
2321	高雄市高雄地區農會	4	9
2322	Reno Sub-Systems Canada Inc.	4	28
2323	英屬開蓋曼群島商 SINOLINKS INVESTMENT CORPORATION	4	41
2324	英屬蓋曼群島商 Ambarella,Inc.	4	22
2325	荷蘭商 Cooperatieve Meadowstream Investment W.A.	4	45
2326	英屬維京群島商歐得國際有限公司 Olmstead International Limited	4	46
2327	美商 Boston-Power, Inc	4	20
2328	荷蘭商道康寧韓國控股公司	4	12
2329	日商住友不動產株式會社	4	11
2330	法商富爾吉股份有限公司 (S.P.C.M.S.A)	4	25
2331	薩摩亞商 GRANDINVEST 控股有限公司	4	23
2332	香港商富斐國際有限公司 FULLFAITH INTERNATIONAL HOLDING LIMITED	4	51
2333	韓商樂金伊諾特股份有限公司	4	13
2334	日商SOCK KOBE CO., LTD.	4	21
2335	美商亞威股份有限公司	4	10
2336	日商菱三株式會社	4	8
2337	薩摩亞商 TTFB World Co., Ltd.	4	25
2338	日商 AUN CONSULTING, INC	4	22
2339	美商 TRIGON COMPONENTS INC.	4	25
2340	日商KANTO  HOLDINGS  CO.,  LTD.	4	29
2341	香港商 SITA Waste Services Limited	4	31
2342	日商株式會社 　　　　　(Aderans Co., Ltd.)	4	31
2343	荷蘭商 GDA B.V. 有限公司	4	17
2344	日商 VS Technology corporation	4	28
2345	IRON MOUNTAIN SOUTHEAST ASIA HOLDINGS LIMITED	4	45
2346	英屬蓋曼群島商芯原控股股份有限公司	4	17
2347	英屬蓋曼群島商 PCL TECHNOLOGIES, INC.	4	30
2348	英屬維京群島商SUCCESS CONCEPT INTERNATIONAL CORP.	4	42
2349	新加坡商 DyStar Global Holdings (Singapore) Pte.Ltd	4	47
2350	日商株式會社娜普菈 (NAPLA CO., LTD.)	4	27
2351	新加坡商碧雅科技私人有限公司	4	14
2352	英屬維京群島商 Ant Value Capital Investment Limited	4	44
2353	法商路易斯威頓公司	4	9
2354	日商　　　　　　株式會社 (日商 AIMEDIA CO., LTD.)	4	35
2355	SINOCA INTERNATIONAL CO., LTD	4	29
2356	英屬維京群島商VIVAINTERNATIONALINVESTMENTCO., LTD.	4	43
2357	日商COSPA CREATION Inc.	4	21
2358	日商 FUJIMAK CORPORATION	4	22
2359	荷蘭商先藝科技有限公司	4	11
2360	新加坡商利樂包亞洲公司	4	11
2361	日商株式会社　　　　(Lecrin)	4	18
2362	SurplusGLOBAL, Inc.	4	19
2363	英屬維京群島商聯合國際亞太公司	4	15
2364	M/A-COM Technology Solutions〈UK〉Limited	4	39
2365	香港商逸聰有限公司(WISECOM LIMITED)	4	26
2366	TS Kelly Workforce Soultions Limited	4	36
2367	日商 YAMABIKO CORPORATION	4	23
2368	英屬安奎拉商 Sky media investments Co., Ltd.	4	38
2369	財團法人基督教愛網全人關懷社會福利慈善事業基金會	4	24
2370	盧森堡商 JAS Worldwide, S.■.r.l.	4	28
2371	荷蘭商 Stanley European Holdings II B.V.	4	37
2372	日商大和化成株式會社	4	10
2373	日商 JIN  CO.,  LTD	4	17
2374	美商 Allergan Holdings, Inc.	4	26
2375	香港商唯晶天行者有限公司	4	12
2376	薩摩亞商偉佳國際股份有限公司	4	14
2377	荷蘭商 DSM 公司	4	10
2378	香港商聯茂投資貿易有限公司	4	13
2379	新加坡商 GIANT INTERNATIONAL HOLDINGS PTE. LTD.	4	43
2380	日商日本電氣硝子株式會社	4	12
2381	薩摩亞商 MGI EXCELLENCE & CO., LTD.	4	31
2382	馬來西亞商國際環球通訊控股公司 (Reach Labuan Holdings Ltd.)	4	44
2383	Kopin Wireless LLC	4	18
2384	英屬維京群島商  EUROCHARM INNOVATION CO.,LTD.	4	38
2385	香港商 PUBLICITAS ASIA HOLDINGS LIMITED	4	36
2386	德商 Oerlikon Leybold Vacuum GmbH	4	31
2387	新加坡商 ERECT GROUP (SINGAPORE) PTE. LTD.	4	38
2388	英屬維京群島商鴻展創業投資有限公司(Foxfortune  Technology  Ventures  Limited)	4	60
2389	英屬開曼群島商 ICHEF CO., LTD.	4	23
2390	鴻程科技有限公司	4	8
2391	薩摩亞商 ASTROGENIE INC.	4	20
2392	英屬開曼群島商TDS Biotechnology Ltd.	4	29
2393	薩摩亞商 ALL STRONG LIMITED	4	23
2394	英屬開曼群島商樺鼎精密機械(開曼)股份有限公司	4	23
2395	薩摩亞商Health Cloud Information Technology Limited	4	47
2396	日商株式會社 LIXIL	4	12
2397	HDX Group (Cayman) Limited喝東西集團(開曼)股份有限公司	4	41
2398	日商DIGITAL FRONTIER INC.	4	23
2399	美商彼得國際有限公司	4	10
2400	ARTHUR JUDY HOLDINGS LIMITED	4	28
2401	荷蘭商Pure Fishing Netherlands B.V.	4	32
2402	薩摩亞商 Sudo Holdings Limited	4	26
2403	薩摩亞商翰利資本有限公司 (HAND SHARP CAPITAL INCORPORATED)	4	46
2404	香港商孚創雲端股份有限公司(INQUARTIK  CO.  LIMITED)	4	38
2405	日商西北貿易株式會社	4	10
2406	美商 BJK&E 公司 (BJK&E, Inc.)	4	25
2407	英屬蓋曼群島商科嘉(開曼)股份有限公司 Ko Ja (Cayman) Co., Ltd.	4	44
2408	荷蘭商Zoetis Netherlands Holdings B.V.	4	35
2409	英屬維京群島商 ACHIEVE TIME INVESTMENTS LIMITED	4	40
2410	瑞典商何格納斯股份有限公司	4	13
2411	日商 PRIMO JAPAN INC.	4	19
2412	日商橫河電機株式會社	4	10
2413	英屬維京島商卓嶽控股份有限公司Xcellent Holding Company Limited	4	47
2414	薩摩亞商NetLink Communication Inc.	4	30
2415	PruWell Investment Limited	4	26
2416	英屬維京群島商KDH DESIGN CO., LTD.	4	27
2417	法商 Sanofi-aventis Participations	4	32
2418	薩摩亞商勝新投資有限公司 WIN NEW INVESTMENTS LIMITED	4	40
2419	新加坡商 Ricoh Asia Pacific Pte Ltd.	4	32
2420	日商 K.K.NAKAGAMI CORPOATION	4	26
2421	英屬維京群島商鼎新股份有限公司	4	15
2422	DAYBREAK GLOBAL GROUP CORP.	4	27
2423	英屬維京群島商 Efficient Logistics Limited	4	35
2424	英屬開曼群島商 KingTiger Memory Solution Inc.	4	38
2425	Fiege Far East Holding Limited	4	30
2426	CKD株式会社(CKD Corporation)	4	24
2427	日商 FACTORY GEAR CO., LTD.（株式会社エス・ジー・アール）	4	40
2428	美商 AHI POST PRODUCTION INC.	4	27
2429	Moker Corp.	4	11
2430	香港商德莎遠東有限公司	4	11
2431	英屬蓋曼群島商 GREEN BREEZE PLANT CORPORATION	4	38
2432	日商半田重工業株式會社	4	11
2433	瑞士商億貝國際公司 (eBay International AG)	4	33
2434	英屬維京群島商 ACADEMY UNIVERSAL CO., LTD	4	34
2435	薩摩亞 EVER SOLUTION LIMITED	4	25
2436	荷蘭商 SYMBIO HOLDING B.V.	4	23
2437	英屬蓋曼群島商CONCRAFT  HOLDING  CO.,LTD	4	33
2438	英屬蓋曼群島商 ScienBiziP Consulting Inc.	4	34
2439	新加坡商 Visa Worldwide Pte. Limited	4	32
2440	Opko Health Inc.	4	16
2441	美商力可公司	4	6
2442	新加坡商逸科亞股份有限公司（EQUVO Pte. Ltd. ）	4	31
2443	日商Suntory  Spirits  Limited	4	27
2444	Magicapital Group Limited 薩摩亞商美智資本集團有限公司	4	40
2445	薩摩亞商TOP POWER INVESTMENTS LIMITED項力投資有限公司	4	41
2446	德商 wpd taiwan holding GmbH	4	26
2447	英屬開曼群島商Yintacom International Inc.	4	34
2448	德商地威公司	4	6
2449	英屬維京群島(New Garment Investment Limited)	4	38
2450	香港商鼎泰有限公司 Gold Progress Limited	4	31
2451	德商 Jade 1343, GmbH & Co. Zweite Verwaltungs KG	4	46
2452	日商株式會社東京精密	4	10
2453	美商奧羅瑞科技公司	4	9
2454	日商豐興工業株式會社	4	10
2455	日商 AJINOMOTO CO., INC.	4	22
2456	日商AIKEI株式會社	4	11
2457	薩摩亞商 SUCCESS  MARINE  LIMITED	4	29
2458	日商三協株式會社	4	8
2459	英屬維京群島商 UbezTT International Investment Holdings (BVI) Ltd.	4	59
2460	英屬維京群島商 Bayshore Pacific Hospitality Limited	4	44
2461	英屬維京島商WINDOWS INTERNATIONAL LINITED	4	35
2462	薩摩亞商WEMO CORP.	4	14
2463	Phisontech Electronics（Malaysia）	4	32
2464	IMS HEALTH INC. 美商健康醫藥服務股份有限公司	4	30
2465	英屬蓋曼群島商 PLURK LIMITED	4	21
2466	薩摩亞商 RAPOZA HOLDINGS LIMITED	4	28
2467	薩摩亞商 YUAN FU TAIWAN HOLDING LIMITED	4	35
2468	薩摩亞商East Gain Investment	4	24
2469	荷蘭商 CTS Overseas Holdings B.V.	4	30
2470	英屬維京群島商ELICENSING INTERNATIOLAL LIMITED	4	39
2471	德商美惠風場兩合有限公司(Meihui Windpark GmbH  & Co. KG)	4	44
2472	薩摩亞商 CMS 智能科技股份有限公司(CMS Intelligent Technology Co., Ltd.)	4	57
2473	日商岩谷產業株式會社	4	10
2474	英屬蓋曼群島商固利運國際股份有限公司(GOOD LINING INTERNATIONAL CO., LTD.)	4	55
2475	日商日本通運株式會社	4	10
2476	日商株式會社名和	4	8
2477	美商朗達科技股份有限公司	4	12
2478	日商趨勢株式會社	4	8
2479	德商庫卡有限公司	4	8
2480	日商 FAST CORPORATION	4	19
2481	Danfoss  A/S	4	12
2482	新加坡商堤雅亞洲投資控股股份有	4	15
2483	新加坡商 Mondelez Asia Pacific Pte. Ltd.	4	36
2484	トラベルブック株式会社	4	11
2485	英商滙豐亞太控股(英國)股份有限公司	4	18
2486	日商 SEMITEC 株式會社	4	15
2487	COVENTIVE 株式會社	4	14
2488	英屬維京群島商 GREENHOPE ENTERPRISES S LTD.	4	36
2489	QQ INTERNATIONAL, LLC	4	21
2490	美商威恩數據科技股份有限公司	4	14
2491	薩摩亞商奇雲國際股份有限公司 (KEYWIN  INTERNATIONAL  INC.)	4	44
2492	日商RENOVA, INC.	4	14
2493	英屬開曼群島商富金機有限公司	4	14
2494	丹麥商 Takeda Pharma A/S	4	21
2495	英屬維京群島商 CITY SUPER (BVI)  LIMITED	4	33
2496	英商 IMI Overseas Investments Limited	4	35
2497	英商 CML 微系統上市公司	4	14
2498	瑞典商 MIMER INFORMATION TECHNOLOGY AB	4	35
2499	日商 KANEKA CORPORATION	4	21
2500	日商株式會社豐隆明和	4	10
2501	日商 Amada Holdings Co., Ltd.	4	27
2502	香港商安捷達集團(亞洲)有限公司	4	16
2503	英商 CooperVision Manufacturing Limited	4	37
2504	日商力ナレ電■株式會社	4	11
2505	英屬蓋曼群島商Da Hui Limited	4	21
2506	加拿大商 Nerium Biotechnology, Inc.	4	31
2507	瑞典商 Axis Communications Aktiebolag	4	34
2508	日商 UNICOM GROUP HOLDINGS, INC	4	29
2509	日商株式會社 ULVAC（ULVAC, INC.）	4	25
2510	德商西門子股份有限公司 (Siemens AG)	4	24
2511	Solid State Display Limited英屬維京群島商	4	34
2512	美商克萊科技股份有限公司	4	12
2513	英屬維京群島商 SHAULA LIMITED	4	22
2514	英屬維京群島商恆亮控股有限公司	4	15
2515	薩摩亞商 WELLS CAPITAL LIMITED	4	26
2516	荷蘭商SUMMIT GLOBAL MANAGEMENT Ⅱ B.V.	4	34
2517	英屬維京群島商EpoStar Electronics (BVI) Corporation	4	44
2518	英屬維京群島商凱羿國際控股有限公司Kayee International Holding Co.,Ltd.	4	53
2519	英屬維京群島商 Dennett Enterprises Limited	4	35
2520	英屬維京群島商 NEW EPOCH INVESTMENT CORP.	4	34
2521	日商MINA テクノロジ一株式會社	4	17
2522	薩摩亞商 ACORN Technology LTD.	4	26
2523	薩摩亞商宏裕國際有限公司	4	12
2524	日商Creative  Technology Corporation	4	34
2525	日商株式會社 Sansei (Sansei Corporation)	4	34
2526	英屬維京群島商高登投資有限公司	4	15
2527	英屬蓋曼群島商宜電科技有限公司	4	15
2528	Hanyu Energy Co., Ltd.	4	22
2529	日商枻出版社株式會社	4	10
2530	荷蘭商通力電梯股份有限公司 Kone Holland B.V.	4	31
2531	韓商 SKC Haas Display Films Co., Ltd.	4	35
2532	香港商SIM Taiwan Holding Company Limited	4	37
2533	英屬開曼群島商Racetrack,Ine	4	20
2534	荷蘭商山域財務有限公司	4	11
2535	澳商 Zoeller International Pty. Ltd.	4	34
2536	日商 HOUSE FOODS GROUP INC.(　　　食品　　　　本社株式会社)	4	42
2537	瑞士商 Sichem Holding AG	4	21
2538	香港商豐寶貿易香港有限公司FENGBAO TRADING HONG KONG LIMITED	4	46
2539	日商日本火腿株式會社	4	10
2540	日商 LINICAL CO., LTD.	4	20
2541	美商 National Instruments Corporation	4	35
2542	香港商威恒企業有限公司	4	11
2543	日商萊茵精機株式會社	4	10
2544	新加坡商 ASAHI GROUP HOLDINGS SOUTHEAST ASIA PTE. LTD.	4	50
2545	新加坡商 KRAMER ELECTRONICS ASIA PACIFIC PTE. LTD.	4	46
2546	法商 Logistique Holding	4	21
2547	新加坡商 Recall Asia Pte Ltd	4	24
2548	薩摩亞商比諾控股集團股份有限公司	4	16
2549	香港商 Edirect  Insure  Group  Limited	4	35
2550	新加坡商 Yushan Investments Pte. Ltd.	4	33
2551	Telmedia Technology Limited	4	27
2552	英屬開曼群島商 Core Elites	4	19
2553	美商福特汽車公司	4	8
2554	薩摩亞商Super Venture Investments Limited	4	37
2555	CASWELL INDUSTRIES LIMITED	4	26
2556	香港商李時珍健康養生股份有限公司	4	16
2557	日商株式會社小森公司	4	10
2558	新加坡商 Sundai Linden School (S) Pte Ltd	4	37
2559	香港商立德國際公證香港有限公司	4	15
2560	英屬維京群島商博克斯國際有限公司	4	16
2561	英屬維京群島商AGB ENTERPRISE LIMITED	4	29
2562	日商株式會社川田	4	8
2563	美商 VISUALON, INC.	4	17
2564	瑞典商 Symphony Teleca AB	4	22
2565	英屬開曼群島商 Youholder Co., Ltd.	4	27
2566	新加坡商 Jinjiufeng Capital Holdings (Pte.Ltd.)	4	43
2567	德商 Industriewerk Schaeffler INA-Ingenieurdienst GMBH	4	52
2568	FOCUS BRIGHT AGENTS LIMITED	4	27
2569	英屬蓋曼群島商頂益︹開曼島︺控股公司	4	18
2570	株式會社■■■■■■ク ■■■■■ン〈Nails Unique of Japan Co.,Ltd〉	4	49
2571	德商 Rockwood Lithium GmbH	4	24
2572	日商株式會社有沢製作所	4	11
2573	荷蘭商DSM Engineering  Plastics International B.V.	4	47
2574	英屬開曼群島商 17FIT INC.	4	18
2575	新加坡商SIBELCO亞洲公司	4	15
2576	比利時商優美科有限公司	4	11
2577	加拿大商 Chipworks Inc.	4	19
2578	香港商摯誠科技有限公司	4	11
2579	財團法人許金德紀念基金會	4	12
2580	奧地利商攀時科技股份有限公司 (PLANSEE SE)	4	27
2581	馬來西亞商Sime Darby Motor Group (Taiwan) Sdn. Bhd.	4	46
2582	日商明德企業株式会社	4	10
2583	香港商復耀顧問有限公司 (GEMINIS ADVISORS LIMITED)	4	38
2584	英屬維京群島商 HENG SHAN INVESTMENT CORPORATION	4	40
2585	英屬維京群島商 KK Foundry Ltd.	4	23
2586	日商希比希株式會社	4	9
2587	日商 UN 控股股份有限公司(UN Holdings Co., Ltd.)	4	37
2588	岩井機械工業株式會社	4	10
2589	香港商盛傲有限公司 Sino Focus Group Limited	4	34
2590	新加坡安華股份有限公司	4	11
2591	英屬維京群島商 WISE MEGA INTERNATIONAL LIMITED	4	39
2592	日商株式會社普羅納克廈斯	4	12
2593	美商好市多國際公司	4	9
2594	印度商 Sohams Foundation Engineering Pvt. Ltd	4	42
2595	株式會社工	4	5
2596	韓商現代商船股份有限公司	4	12
2597	模里西斯商SUPER ELITE LIMITED	4	24
2598	荷蘭商 Axia Power Holdings B.V.	4	28
2599	韓商AfreecaTV Co., Ltd	4	20
2600	InnoMedia PTE LTD	4	17
2601	財團法人耕心蓮苑教育基金會	4	13
2602	英屬維京群島商DVDonet.com. Inc.	4	24
2603	英屬維京群島商卓期國際有限公司(BEST SEASON INTERNATIONAL LIMITED)	4	50
2604	英屬維京群島商 Duanhua Holding Limited	4	31
2605	香港商 Ernst & Young AKT Limited	4	29
2606	英屬維京群島商 PURE INVESTMENT GLOBAL CORP.	4	36
2607	荷蘭商Corsair Memory B.V.	4	22
2608	法商 Recif Technologies	4	21
2609	日本特殊陶業株式會社	4	10
2610	美商 Translink Management III, L.L.C.	4	35
2611	日商三菱樹脂株式會社	4	10
2612	日商FUTEC INC.（株式会社ヒユーテシク）	4	24
2613	Elegant Future (Hong Kong) Limited (錩和實業(香港)有限公司)	4	49
2614	美商新采國際股份有限公司	4	12
2615	韓國現代商船股份有限公司	4	12
2616	愛爾蘭商SanDisk Manufacturing	4	25
2617	荷蘭商 Accenture Holdings BV	4	25
